{
  "schema_version": 1,
  "source": {
    "host": "fileserver.corp",
    "role": "ROLE_STANDALONE"
  },
  "generation_id": "d6e66eb5-5f47-43e8-a9d4-41f5a1b5a2ac",
  "generated_at": "2026-08-12T22:00:00Z",
  "managed_groups": [
    "samba-users",
    "samba-admin",
    "samba-laudos",
    "samba-laudos-mega",
    "samba-administrativo"
  ],
  "groups": {
    "samba-users": ["ana", "joao"],
    "samba-admin": [],
    "samba-laudos": ["ana"],
    "samba-laudos-mega": [],
    "samba-administrativo": ["joao"]
  },
  "users": ["ana", "joao"],
  "counts": {
    "users": 2,
    "groups": 5
  }
}

